,Kanji,Word,Meaning
0,縁起がいい,えんぎがいい,"เป็นมงคล,ฤกษ์ดี"
1,英邁・英まい,えいまい,สติปัญญาเป็นเลิศ
2,えら,エラ,1.เหงือก 2.กราม
3,柄,え,"ด้าม,ที่จับ"
4,江,え,อ่าวเล็ก ๆ
5,絵,え,รูปวาด
6,えい,えい,ปลากระเบน
7,鋭意,えいい,"อย่างเต็มที่,อย่างสุดกำลัง"
8,影印,えいいん,การพิมพ์โดยถ่ายภาพต้นฉบับเดิม
9,営々,えいえい,อย่างขยันขันแข็ง
10,永遠,えいえん,"นิรันดร์,ตลอดกาล,ชั่วกัลปาวสาน"
11,英貨,えいか,เงินตราของอังกฤษ
12,"<a href=""/dictionary/show/3355"">映画</a>",えいが,"ภาพยนตร์,หนัง"
13,英会話,えいかいわ,การสนทนาด้วยภาษาอังกฤษ
14,映画化,えいがか,การนำไปสร้างเป็นภาพยนตร์
15,映画館,えいがかん,โรงภาพยนตร์
16,映画鑑賞,えいがかんしょう,การดูหนัง
17,映画鑑賞する,えいがかんしょうする,ชมภาพยนตร์
18,映画監督,えいがかんとく,ผู้กำกับภาพยนตร์
19,鋭角,えいかく,มุมแหลม
20,鋭角三角形,えいかくさんかくけい,สามเหลี่ยมมุมแหลม
21,映画倫理規定委員会,えいがりんりきていいいんかい,คณะกรรมการพิจารณาภาพยนตร์
22,栄冠,えいかん,"เกียรติยศ,มงกุฏแห่งชัยชนะ"
23,英気,えいき,"ความหลักแหลม,ปราดเปรื่อง,กำลังใจ"
24,鋭気,えいき,"ความหึกเหิม,ความองอาจ"
25,永久,えいきゅう,"ถาวร,ตลอดกาล"
26,永久的,えいきゅうてき,แบบถาวร
27,"<a href=""/dictionary/show/3370"">影響</a>",えいきょう,"ผลกระทบ,อิทธิพล,กระทบกระเทือนต่อ,มีผลให้"
28,営業,えいぎょう,"1.การดำเนินธุรกิจ,การบริหารการตลาด 2.การเปิดทำการของร้านค้า 3.งานขาย,งานเซลล์"
29,営業案内,えいぎょうあんない,หนังสือแนะนำบริษัท
30,営業時間,えいぎょうじかん,เวลาทำการ
31,営業所,えいぎょうしょ,สำนักงานขาย สาขาของบริษัท
32,影響する,えいきょうする,อิทธิพล
33,営業中,えいぎょうちゅう,เปิดบริการ
34,営業部,えいぎょうぶ,ฝ่ายขาย
35,営業マン,えいぎょうマン,"พนักงานขาย,เซลส์แมน"
36,影響をうける,えいきょうをうける,ได้รับอิทธิพล
37,永訣,えいけつ,"ตายจากไป,จากกันชั่วนิรันดร์"
38,英傑,えいけつ,วีรบุรุษ
39,"<a href=""/dictionary/show/3382"">英語</a>",えいご,ภาษาอังกฤษ
40,曳航,えいこう,"พ่วง(เรือ),ลากโยง"
41,栄光,えいこう,"เกียรติศักดิ์,เกียรติภูมิ"
42,永劫,えいごう,ชั่วนิรันดร
43,英国,えいこく,"สหราชอาณาจักร,อังกฤษ"
44,"<a href=""/dictionary/show/3387"">栄枯盛衰</a>",えいこせいすい,ความรุ่งโรจน์และการล่มสลาย
45,英才,えいさい,ผู้มีสติปัญญาเป็นเลิศ
46,英姿,えいし,ร่างอันทรนงองอาจ
47,衛視,えいし,เจ้าหน้าที่รักษาความสงบในรัฐสภา
48,嬰児,えいじ,"ทารก,เด็กอ่อน,เด็กเล็ก(ไม่เกิน 3 ขวบ)"
49,英字,えいじ,ตัวอักษรภาษาอังกฤษ
50,映写,えいしゃ,การฉายภาพยนตร์หรือสไลด์
51,映写機,えいしゃき,"เครื่องโปรเจคเตอร์,เครื่องฉายหนัง"
52,映写室,えいしゃしつ,ห้องฉายหนัง
53,永住,えいじゅう,การตั้งหลักแหล่งอย่างถาวร
54,永住ビザ,えいじゅうビザ,วีซ่าถาวร วีซ่าตลอดชีพ
55,詠出,えいしゅつ,ประพันธ์(บทกวี)
56,詠唱,えいしょう,ขับร้อง(บทกวี)
57,栄進,えいしん,"การส่งเสริมให้เจริญก้าวหน,การพัฒนารุ่งเรือง"
58,詠ずる,えいずる,"ประพันธ์,ร้อยกรอง,ขับ(บทกวี)"
59,永世,えいせい,อมตะ
60,永生,えいせい,อมตะ
61,衛星,えいせい,"ดาวเทียม,ดาวบริวาร"
62,衛生,えいせい,อนามัย
63,衛生学,えいせいがく,สุขภาพศาสตร์
64,衛生局,えいせいきょく,กรมอนามัย
65,衛生検査技学部,えいせいけんさぎがくぶ,คณะเทคนิคการแพทย์
66,衛星中継,えいせいちゅうけい,การถ่ายทอดผ่านดาวเทียม
67,永世中立,えいせいちゅうりつ,การเป็นกลางอย่างถาวร
68,衛生的,えいせいてき,"ถูกสุขลักษณะ,ถูกอนามัย"
69,衛生陶器,えいせいとうき,สุขภัณฑ์
70,衛星放送,えいせいほうそう,การถ่ายทอดผ่านดาวเทียม เรียกได้อีกอย่างว่า CS放送
71,営繕,えいぜん,การซ่อมบำรุง
72,営倉,えいそう,คุกในค่ายทหารญี่ปุ่นในอดีต
73,営巣,えいそう,การทำรัง
74,営造,えいぞう,การก่อสร้างโครงการใหญ่
75,影像,えいぞう,"ภาพที่ปรากฏบนจอหรือเลนส์,เงาสะท้อนในกระจกหรือบนผิวน้ำ,ภาพในใจ"
76,映像,えいぞう,"1.ภาพเหมือน,รูปปั้น 2.ภาพเคลื่อนไหว วีดีโอ 3.อิมเมจ ภาพ (ที่ลอยขึ้นมาในหัว)"
77,永続,えいぞく,การดำรงอยู่ตลอดไป
78,永代,えいたい,"อย่างถาวร,ตลอดไป"
79,栄達,えいたつ,การเลื่อนตำแหน่ง
80,詠嘆,えいたん,การอุทานด้วยความทึ่งหรือชื่นชม
81,詠歎,えいたん,การอุทานด้วยความทึ่งหรือชื่นชม
82,営団,えいだん,องค์กรภายใต้ควบคุมของรัฐในสมัยสงครามโลกครั้งที่ 2 ปัจจุบันเหลือเพียงบริษัทรถไฟใต้ดิน (ในประเทศญี่ปุ่น)
83,英断,えいだん,การกล้าตัดสินใจ
84,栄典,えいてん,"เหรียญตรา,ยศศักดิ์,เครื่องราชอิสริยาภรณ์"
85,栄転,えいてん,การไปรับตำแหน่งที่สูงขึ้นในต่างสาขา
86,英独,えいどく,อังกฤษและเยอรมัน
87,英トン,えいトン,น้ำหนัก ตัน ของอังกฤษ = 2240 ปอนด์ หรือ 1016 กิโลกรัม
88,英噸,えいとん,น้ำหนัก ตัน ของอังกฤษ = 2240 ปอนด์ หรือ 1016 กิโลกรัม
89,英屯,えいとん,น้ำหนัก ตัน ของอังกฤษ = 2240 ปอนด์ หรือ 1016 กิโลกรัม
90,永年,えいねん,นานปี
91,営農,えいのう,"การทำนาทำไร่,การจัดการเกษตรกรรม"
92,鋭敏,えいびん,"เฉียบแหลม,หัวไว,ไหวพริบดี"
93,英仏,えいふつ,อังกฤษและฝรั่งเศส
94,英仏海峡,えいふつかいきょう,ช่องแคบอังกฤษ
95,英文,えいぶん,ประโยคในภาษาอังกฤษ
96,英文学,えいぶんがく,วรรณคดีอังกฤษ
97,英文法,えいぶんぽう,ไวยากรณ์อังกฤษ
98,衛兵,えいへい,ทหารยาม
99,英米,えいべい,อังกฤษและอเมริกา
100,英米人,えいべいじん,ชาวอังกฤษและชาวอเมริกัน
101,永別,えいべつ,"ตายจากกัน,จากกันชั่วนิรันดร์"
102,泳法,えいほう,"วิธีการว่ายน้ำ,ท่าว่ายน้ำ"
103,英法,えいほう,กฎหมายของอังกฤษ
104,鋭鋒,えいほう,"ปลายแหลม,การโจมตีอย่างรุนแรง"
105,永眠,えいみん,หลับชั่วนิรันดร์(เสียชีวิต)
106,英明,えいめい,"ฉลาดเลิศ,ปราดเปรื่อง"
107,英訳,えいやく,การแปลเป็นภาษาอังกฤษ
108,英雄,えいゆう,วีรบุรุษ
109,栄誉,えいよ,"เกียรติยศ,เกียรติศักดิ์"
110,栄養,えいよう,"คุณค่าทางอาหาร,ธาตุอาหาร,การบำรุงร่างกาย"
111,栄耀栄華,えいようえいが,"หรูหรา,ฟู่ฟ่า,รุ่งเรือง"
112,栄養学者,えいようがくしゃ,"นักโภชนาการ,ผู้เชี่ยวชาญด้านโภชนาการ"
113,栄養失調,えいようしっちょう,โรคขาดสารอาหาร
114,営利,えいり,"การหวังผลกำไร,การหวังผลประโยชน์ทางธุรกิจ"
115,鋭利,えいり,"คมกริบ,เฉียบแหลม,ไหวพริบดี"
116,映倫,えいりん,คณะกรรมการพิจารณาภาพยนตร์
117,営林局,えいりんきょく,กรมป่าไม้
118,英霊,えいれい,วิญญาณของวีรชน
119,英和,えいわ,อังกฤษและญี่ปุ่น
120,英和辞典,えいわじてん,พจนานุกรมอังกฤษ-ญี่ปุ่น
121,詠ずる,えうずる,"ประพันธ์,ร้อยกรอง"
122,ええ,ええ,"ครับ,ค่ะ,อืม"
123,ええと,ええと,เอ่อ   คือว่า
124,笑顔,えがお,ใบหน้ายิ้มแย้ม
125,絵描き,えかき,"จิตรกร,นักวาดรูป"
126,描く,えがく,"วาด,เขียน(รูป)"
127,画く,えがく,"วาด,เขียน(รูป)"
128,得難い,えがたい,"หายาก,ยากจะได้มา"
129,絵柄,えがら,"1.ลวดลายบนผืนผ้า,งานศิลปหัตถกรรม 2.หน้า หรือ ภาพในตู้สล๊อต"
130,液,えき,ของเหลว
131,益,えき,"คุณประโยชน์,กำไร"
132,"<a href=""/dictionary/show/3488"">駅</a>",えき,สถานีรถไฟ
133,駅員,えきいん,พนักงานสถานีรถไฟ
134,液化,えきか,การกลายสภาพเป็นของเหลว
135,易学,えきがく,โหราศาสตร์
136,疫学,えきがく,"การศึกษาเรื่องการแพร่ของโรคระบาด ตลอดจนผลกระทบต่าง ๆ ต่อสุขภาพของชุมชน,ระบาดวิทยา"
137,疫学者,えきがくしゃ,นักระบาดวิทยา
138,益金,えききん,เงินกำไร
139,液剤,えきざい,"ยาน้ำ,น้ำยา"
140,易者,えきしゃ,หมอดู
141,駅舎,えきしゃ,อาคารสถานีรถไฟ
142,液晶,えきしょう,"ผลึกเหลว,สารโปร่งแสงกึ่งแข็งกึ่งเหลว,ลิควิดคริสตอล"
143,液状,えきじょう,สภาวะของเหลว
144,液晶ディスプレイ,えきしょうディスプレイ,"จอภาพผลึกเหลว,จอ LCD"
145,液晶テレビ,えきしょうテレビ,ทีวีจอแอลซีดี
146,液体,えきたい,ของเหลว
147,易断,えきだん,"การดูดวง,การทำนายทายทัก"
148,役畜,えきちく,สัตว์ที่เลี้ยงไว้ใช้งาน
149,益虫,えきちゅう,แมลงที่ให้คุณประโยชน์
150,益鳥,えきちょう,นกที่ให้คุณประโยชน์
151,駅長,えきちょう,นายสถานี
152,駅伝,えきでん,การแข่งขันวิ่งผลัดระยะไกล
153,駅伝競走,えきでんきょうそう,การแข่งขันวิ่งผลัดระยะไกล
154,駅頭,えきとう,หน้าสถานีรถไฟ
155,駅止め,えきどめ,การส่งสินค้าทางรถไฟ โดยให้ผู้รับมารับของที่สถานีปลายทาง
156,駅留め,えきどめ,การส่งสินค้าทางรถไฟ โดยให้ผู้รับมารับของที่สถานีปลายทาง
157,疫病,えきびょう,โรคระบาด
158,駅弁,えきべん,1.อาหารกล่องที่ขายบริเวณสถานีรถไฟ หรือ ในรถไฟ 2.ท่าลิงอุ้มแตง (ท่าตอนมีเพศสัมพันธ์)
159,駅前,えきまえ,ด้านหน้าสถานีรถไฟ
160,役務,えきむ,"งานบริการ,การบริการ"
161,役務賠償,えきむばいしょう,การทำงานหรือใช้แรงงานเพื่อชดใช้ค่าเสียหาย
162,役務費,えきむひ,ค่าบริการ
163,疫痢,えきり,โรคบิดที่เกิดในเด็ก
164,笑窪,えくぼ,ลักยิ้ม
165,靨,えくぼ,ลักยิ้ม
166,抉る,えぐる,"คว้าน,ใช้มีดขูดเป็นหลุม,จับตรงประเด็น"
167,えげつない,えげつない,"1.น่ารังเกียจ,ทุเรศ 2.โจ๋งครึ่ม 3.สุดตรีน (ตอนรู้สึกเกินคาด,เหลือเชื่อว่าจะทำได้)"
168,餌,えさ,"อาหารสัตว์,เหยื่อ,เหยื่อล่อ"
169,餌食,えじき,"เหยื่อ,เป้าโจมตี หรือ ทำร้าย "
170,"<a href=""/dictionary/show/3543"">会釈</a>",えしゃく,การผงกศีรษะทักทาย
171,枝,えだ,"กิ่ง,ก้าน"
172,枝豆,えだまめ,"ถั่วเขียว,ถั่วแระ(ที่ญี่ปุ่นนิยมต้มเกลือทานเป็นกับแกล้มเบียร์)"
173,えっ,えっ,เอ๊ะ
174,越,えつ,"เกิน,ข้าม"
175,閲,えつ,"ดู,ตรวจตรา,ผ่านไป"
176,越境,えっきょう,"การข้ามแดน,การล้ำแดน,การล่วงล้ำอาณาเขต"
177,越権,えっけん,การใช้สิทธิอำนาจเกินขอบเขต
178,越冬,えっとう,"การไปพักที่ใดที่หนึ่งระหว่างฤดูหนาว,การใช้ชีวิตในช่วงฤดูหนาว"
179,閲読,えつどく,"การอ่าน,การอ่านอย่างพินิจพิจารณา"
180,越年,えつねん,"การส่งท้ายปีเก่าต้อนรับปีใหม่,(พืช)ที่มีอายุเพียงสองปี"
181,閲兵,えっぺい,การตรวจแถวทหาร
182,悦楽,えつらく,"เปรมปรีดิ์,เริงร่า,ปิติ"
183,閲覧,えつらん,การอ่านค้นคว้า การดูเว็บไซต์
184,閲覧室,えつらんしつ,ห้องสำหรับอ่านค้นคว้า
185,閲歴,えつれき,ประวัติ (ของคน)
186,得手,えて,"ถนัด,เห็นแก่ตัว"
187,干支,えと,"12 นักษัตร,12 ราศี"
188,江戸,えど,สมัยเอโดะ ชื่อเมืองหลวงเก่าของโตเกียว
189,会得,えとく,การเรียนรู้อย่างเข้าถึงแก่น
190,絵の具,えのぐ,สี(สำหรับวาดภาพ)
191,絵はがき,えはがき,โปสการ์ด
192,絵葉書,えはがき,แผ่นภาพที่เป็นไปรษณียบัตรหรือโปสการ์ด
193,海老,えび,กุ้ง
194,蝦,えび,กุ้ง
195,えびのすり身,えびのすりみ,ลูกชิ้นกุ้ง
196,愛媛県,えひめけん,จังหวัดเอะฮิเมะ
197,えへん,えへん,แฮ่ม
198,絵本,えほん,หนังสือรูปภาพ
199,絵馬,えま,แผ่นไม้รูปม้า ใช้เขียนคำอธิษฐานในศาลเจ้าและวัด
200,絵巻,えまき,ภาพวาดที่มีลักษณะเป็นม้วนยาว
201,絵巻物,えまきもの,ภาพวาดที่มีลักษณะเป็นม้วนยาว
202,笑む,えむ,ยิ้ม
203,獲物,えもの,"สัตว์ที่ล่าได้,สิ่งที่ปล้นหรือยึดมาได้"
204,偉い,えらい,"1.ยิ่งใหญ่ 2.เป็นใหญ่,ใหญ่โต,โอหัง,ลำพอง,อวดดี 3. เก่ง น่ายกย่อง"
205,"<a href=""/dictionary/show/3621"">選ぶ</a>",えらぶ,"เลือก,คัดเลือก"
206,選べる,えらべる,เลือกได้
207,衿,えり,"ปกเสื้อ,คอเสื้อ"
208,襟,えり,"ปกเสื้อ,คอเสื้อ"
209,襟足,えりあし,"ท้ายทอย,ต้นคอ"
210,襟髪,えりがみ,ผมท้ายทอย
211,襟首,えりくび,คอเสื้อ
212,襟巻き,えりまき,ผ้าพันคอ
213,襟元,えりもと,บริเวณคอเสื้อ
214,得る,える,ได้รับ
215,獲る,える,"เอามาให้ได้,ได้มา"
216,選る,える,เลือก
217,円,えん,สกุลเงินเยนของประเทศญี่ปุ่น
218,園,えん,สวน... (ที่มนุษย์สร้างขึ้น เช่น สวนสาธารณะ)
219,宴,えん,งานเลี้ยง
220,遠泳,えんえい,การว่ายน้ำระยะทางไกล
221,円価,えんか,ค่าเงินเยน
222,円貨,えんか,สกุลเงินเยน
223,塩化,えんか,การเจือคลอรีนให้เป็นสารประกอบประเภทคลอไรด์
224,演歌・艶歌,えんか,เพลงรำพันถึงความโศกเศร้าแบบญี่ปุ่น มักร้องเล่นลูกคอแบบเพลงลูกทุ่ง
225,宴会,えんかい,"งานเลี้ยง,ปาร์ตี้"
226,延会,えんかい,"การเลื่อนการประชุมสภาไปประชุมต่อในวันต่อมา,การเลื่อนประชุมใหญ่ผู้ถือหุ้น"
227,沿海,えんかい,ชายฝั่ง
228,遠海,えんかい,กลางทะเล
229,塩害,えんがい,"ผลกระทบจากเกลือที่มากับลมจากทะเล,ผลกระทบจากการซึมของน้ำเค็มใต้ดินที่ทำให้ดินเค็ม"
230,煙害,えんがい,โทษของควัน
231,沿革,えんかく,ประวัติความเป็นมา
232,遠隔,えんかく,"ระยะไกล,อยู่ห่างไกลกัน"
233,遠隔操作,えんかくそうさ,"การควบคุมระยะไกล,การบังคับระยะไกล"
234,円滑,えんかつ,"ความราบรื่น,ปรองดอง"
235,円滑に,えんかつに,"อย่างราบรื่น,โดยราบรื่น"
236,縁側,えんがわ,เฉลียงไม้กระดานของบ้านแบบญี่ปุ่น
237,鉛管,えんかん,ท่อตะกั่ว
238,沿岸,えんがん,ชายฝั่ง
239,塩基,えんき,สารที่เป็นด่าง
240,延期,えんき,การเลื่อน(กำหนด วัน เวลา)
241,"<a href=""/dictionary/show/3677"">演技</a>",えんぎ,การแสดง
242,演義,えんぎ,การเล่าเรื่องให้ง่ายและชวนติดตาม
243,縁起,えんぎ,"ลางบอกเหตุ,ประวัติความเป็นมาของวัด"
244,縁起物,えんぎもの,ของที่ประดับไว้เพื่อความเป็นมงคล
245,婉曲,えんきょく,"การพูดอ้อม ๆ,การเลี่ยงไปใช้คำอื่นแทนคำที่ไม่เป็นมงคลหรือไม่เหมาะกับกาละเทศะ"
246,遠距離,えんきょり,"ระยะไกล,ทางไกล"
247,遠近法,えんきんほう,"เทคนิคการเขียนภาพให้ได้ส่วนสัด เช่นเดียวกับที่เห็นด้วยตาจริง,ส่วนสัดที่ปรากฏแก่สายตา"
248,援軍,えんぐん,กองหนุน
249,円形,えんけい,รูปวงกลม
250,園芸,えんげい,การปลูกพืชในสวนหรือเรือนกระจก พืชกรรมสวน
251,演芸,えんげい,มหรสพแบบเก่าของญี่ปุ่น
252,演劇,えんげき,การแสดง(ละคร)
253,演劇部,えんげきぶ,ชมรมการละคร
254,円弧,えんこ,ส่วนโค้งของวงกลม
255,援護,えんご,การช่วยเหลือบรรเทาทุกข์
256,円滑,えんこつ,ราบรื่น
257,怨恨,えんこん,ความโกรธแค้นชิงชัง
258,怨嗟,えんさ,เสียงก่นว่าด้วยความเจ็บแค้น
259,円座,えんざ,การนั่งเป็นวงกลม
260,冤罪,えんざい,"ข้อกล่าวหาเท็จ,ข้อกล่าวหาหรือการกล่าวโทษคนบริสุทธิ์,ความผิดพลาดในกระบวนการยุติธรรม "
261,縁先,えんさき,ริมเฉลียงส่วนที่ติดสวน
262,塩酸,えんさん,"กรดไฮโดรคลอริก,กรดเกลือ"
263,演算,えんざん,การประมวลผล
264,演算回路,えんざんかいろ,วงจรประมวลผล
265,演算機,えんざんき,"หน่วยประมวลผล,โปรเซสเซอร์ (ในคอมพิวเตอร์)"
266,演算時間,えんざんじかん,เวลาในการประมวลผล
267,演算処理ユニット,えんざんしょりユニット,"หน่วยประมวลผลที่ทำหน้าที่คำนวณทางคณิตศาสตร์ และเปรียบเทียบทางตรรกะ,Arithmetic and Logic Unit (ALU)"
268,演算手順,えんざんてじゅん,อัลกอริทึม (คอมพิวเตอร์)
269,遠視,えんし,สายตายาว
270,園児,えんじ,นักเรียนอนุบาล
271,臙脂,えんじ,สีแดงเข้ม
