,Kanji,Word,Meaning
272,遠日点,えんじつてん,จุดในวิถีโคจรของดาวที่ห่างจากดวงอาทิตย์ที่สุด
273,縁者,えんじゃ,ญาติ
274,円周,えんしゅう,เส้นรอบวง
275,演習,えんしゅう,"การฝึกซ้อม,การซ้อมรบ,ชั่วโมงเรียนแบบสัมมนา"
276,円周率,えんしゅうりつ,ค่า Pi (3.1415926..)
277,円熟,えんじゅく,"(วิชาความรู้)แก่กล้า,(นิสัย)สุขุมเป็นผู้ใหญ่"
278,演出,えんしゅつ,1.การอำนวยการสร้าง 2.การเติมสีสันให้กับงานที่จัด 3.ลูกเล่น เอฟเฟค
279,炎暑,えんしょ,ร้อนจัด
280,援助,えんじょ,การช่วยเหลือ การสงเคราะห์ การสนับสนุน
281,延焼,えんしょう,ไฟไหม้ลุกลาม
282,炎症,えんしょう,การอักเสบ
283,焔硝,えんしょう,"ดินปืน,ดินประสิว"
284,煙硝,えんしょう,"ดินปืน,ดินประสิว"
285,艶笑,えんしょう,"การยิ้มยั่วยวน,เรื่องอีโรติกแนวขบขัน"
286,炎上,えんじょう,1.ไฟลุกท่วม 2.บล๊อค หรือ เว็บไซต์ที่ถูกรุมด่า เนื่องจากไปโพสอะไรไม่ดีไว้ 3.ดราม่า
287,炎症止め,えんしょうどめ,ยาลดการอักเสบ
288,援デリ,えんでり,ผู้หญิงขายบริการทางเพศ (ไปหาลูกค้าถึงที่) แบบผิดกฎหมายที่มีนายหน้าคอยช่วยหางานให้ (ไม่ได้ขอใบอนุญาตเปิดกิจการ)
289,演じる,えんじる,แสดงละคร
290,遠心,えんしん,การเหวี่ยงออกจากจุดศูนย์กลาง
291,遠心力,えんしんりょく,"1,แรงเหวี่ยงออกจากจุดศูนย์กลาง 2.แรงดึงดูดคนรอบข้างลดลง"
292,円錐,えんすい,ทรงกรวย
293,塩水,えんすい,น้ำเกลือ
294,演ずる,えんずる,"แสดง(ละคร),สวมบทบาท"
295,遠征,えんせい,1.ออกไปทำศึกหรือแข่งกีฬาไกล ๆ 2.เดินทางไปสำรวจ
296,宴席,えんせき,งานเลี้ยง
297,演説,えんぜつ,"การปราศรัย,การแสดงปาฐกถา"
298,沿線,えんせん,ตลอดสองฟากฝั่งของถนนหรือทางรถไฟ
299,塩素,えんそ,สารคลอรีน
300,"<a href=""/dictionary/show/3750"">演奏</a>",えんそう,การแสดงดนตรี
301,演奏会,えんそうかい,"งานแสดงดนตรี,คอนเสิร์ต"
302,演奏する,えんそうする,บรรเลง
303,円相場,えんそうば,ค่าเงินเยน
304,遠足,えんそく,"การเดินเท้าเพื่อทัศนศึกษาหรือร่วมกิจกรรมทางโรงเรียน,การไปเที่ยวปิกนิกเป็นหมู่คณะ"
305,塩素水,えんそすい,น้ำคลอรีน
306,延滞,えんたい,"การค้างชำระ,การหน่วงเหนี่ยว,การชักช้าจนเลยกำหนด"
307,円高,えんだか,"ค่าเงินเยนแข็งตัวขึ้น,ค่าเงินเยนสูง"
308,演壇,えんだん,เวทีกล่าวปราศรัยหรือแสดงปาฐกถา
309,縁談,えんだん,การทาบทามสู่ขอ
310,円柱,えんちゅう,"เสากลม,แท่งกระบอก"
311,園長,えんちょう,ครูใหญ่(โรงเรียนอนุบาล)
312,延長,えんちょう,"การต่อ(เวลา),ขยาย"
313,延長する,えんちょうする,ต่อ
314,堰堤,えんてい,เขื่อน
315,園丁,えんてい,คนสวน
316,炎天,えんてん,วันที่แดดเปรี้ยงร้อนจัด
317,塩田,えんでん,นาเกลือ
318,円筒,えんとう,"กระบอก,ทรงกระบอก"
319,遠島,えんとう,เกาะกลางทะเล
320,沿道,えんどう,"ข้างทาง,ตามทาง,สองฟากทาง"
321,豌豆,えんどう,ถั่วลันเตา
322,円筒形,えんとうけい,รูปทรงกระบอก
323,豌豆豆,えんどうまめ,ถั่วลันเตา
324,縁遠い,えんどおい,"1.ไม่มีดวงเจอเนื้อคู่,ไม่มีโชคเรื่องคู่ครอง 2.ห่างไกล,ไม่ค่อยเกี่ยวข้อง,แทบไม่ได้ยุ่งเกี่ยว (กับเรื่องราวนั้นๆ) "
325,鉛毒,えんどく,พิษจากตะกั่ว
326,煙突,えんとつ,ปล่องไฟ
327,円内,えんない,ภายในวงกลม
328,園内,えんない,ภายในสวน
329,縁日,えんにち,งานวัด
330,炎熱,えんねつ,ความร้อนแผดเผา
331,延納,えんのう,"การค้างชำระ,การชำระล่าช้า"
332,縁の下の力持ち,えんのしたのちからもち,การปิดทองหลังพระ หรือ ผู้ปิดทองหลังพระ
333,円盤,えんばん,"จานเสียง,แผ่นกลม,จานจักร(กีฬา)"
334,鉛版,えんばん,แผ่นโลหะแม่พิมพ์ที่จำลองตัวเรียงพิมพ์
335,円盤投げ,えんばんなげ,กีฬาขว้างจักร
336,鉛筆,えんぴつ,ดินสอ
337,鉛筆削り,えんぴつけずり,"ที่เหลาดินสอ,กบเหลาดินสอ"
338,鉛筆の心,えんぴつのしん,ไส้ดินสอ
339,円舞曲,えんぶきょく,เพลงวอลทซ์
340,艶福,えんぷく,(ผู้ชาย)เสน่ห์แรง
341,塩分,えんぶん,สัดส่วนหรือส่วนผสมของเกลือในอาหาร
342,艶聞,えんぶん,"ข่าวคาว,ข่าวลือเรื่องรัก ๆ ใคร่ ๆ"
343,掩蔽,えんぺい,"การบดบัง,การปิดบัง"
344,援兵,えんぺい,กองทหารสนับสนุน
345,縁辺,えんぺん,"ขอบ,รอบ ๆ,คนที่อยู่รอบข้าง,คนที่เกี่ยวดองกัน"
346,遠望,えんぼう,การทอดสายตามองไปไกล ๆ
347,遠謀,えんぼう,มองการณ์ไกล
348,遠方,えんぽう,แดนไกล
349,閻魔,えんま,"พญายม,มัจจุราช"
350,煙幕,えんまく,ม่านควันที่ใช้อำพรางตนจากข้าศึก
351,円満,えんまん,"ความกลมเกลียว,ความปรองดอง,(นิสัย)ไม่มีพิษมีภัย"
352,煙霧,えんむ,"หมอกและควัน,หมอกควันที่เป็นอากาศเสีย"
353,縁結び,えんむすび,"การจับคู่ตุนาหงัน,การอธิษฐานขอให้สมหวังในรัก"
354,延命,えんめい,"การต่ออายุขัย,การยืดชีวิต"
355,沿面距離,えんめんきょり,ระยะห่างตามแนวขนานของสิ่งของ 2 สิ่ง
356,演目,えんもく,รายการ หรือ ลำดับ เพลง การแสดง โชว์ต่างๆ ที่เปิดแสดง
357,円安,えんやす,ค่าเงินเยนอ่อนตัวลง
358,園遊会,えんゆうかい,"งานเลี้ยงที่จัดในสวน,อุทยานสโมสร"
359,援用,えんよう,การอ้างพยานหลักฐานหรือคำพูดของบุคคลหนึ่งเพื่อใช้สนับสนุนคำพูดของตน
360,遠洋,えんよう,กลางมหาสมุทร
361,遠来,えんらい,มาจากที่ไกล ๆ
362,遠雷,えんらい,เสียงฟ้าร้องที่ดังมาจากที่ไกล ๆ
363,遠慮,えんりょ,ความเกรงใจ
364,遠慮する,えんりょする,เกรงใจ
365,遠慮なく,えんりょなく,โดยไม่เกรงใจ
366,塩類,えんるい,เกลือแกง
367,艶麗,えんれい,"งดงาม,เฉิดฉาย"
368,円顱,えんろ,"การโกนหัว,สกินเฮด"
369,遠路,えんろ,"แดนไกล,หนทางไกล"
370,英国人,えいこくじん,คนอังกฤษ 
371,塩素系漂白剤,えんそけいひょうはくざい,สารฟอกขาวจำพวกผสมสารคลอรีน
372,MMK,えむえむけい,ฮอตเกิน ป๊อปเกิน (เป็นที่กรี๊ดจากเพศตรงข้ามมากจนลำบากใจ)
373,営利主義,えいりしゅぎ,คนที่มุ่งแต่ผลประโยชน์ คนที่มองแต่ผลประโยชน์เป็นหลัก
374,営利会社,えいりかいしゃ,บริษัทที่มุ่งแต่ผลประโยชน์ บริษัทที่มองแต่ผลประโยชน์เป็นหลัก
375,営利行為,えいりこうい,พฤติกรรมที่มุ่งแต่ผลประโยชน์
376,営利事業,えいりじぎょう,งานที่มุ่งแต่ผลประโยชน์
377,営利資本,えいりしほん,การลงทุนที่มุ่งแต่ผลประโยชน์ เงินลงทุนที่ถูกใช้ที่เพื่อผลประโยชน์
378,営利社団,えいりしゃだん,นิติบุคคลที่ประกอบธุรกิจโดยเ้น้นไปที่ผลประโยชน์ทางการเงินเป็นหลัก
379,営利法人,えいりほうじん,นิติบุคคลที่ประกอบธุรกิจโดยเ้น้นไปที่ผลประโยชน์ทางการเงินเป็นหลัก
380,営利的,えいりてき,การเ้น้นไปที่ผลประโยชน์ทางการเงินเป็นหลัก
381,営利保険・営業保険,えいりほけん・えいぎょうほけん,องค์กร หรือ บริษัท ที่เน้นการขายประกัน ในการดำเนินธุรกิจ 
382,営利誘拐財,えいりゆうかいざい,ความผิดฐานชักชวน หรือ หลอกลวงผู้คนให้หลงเชื่อทางธุรกิจ และ เกิดการสูญเงินขึ้น
383,エールを送る,えーるをおくる,ส่งเสียงเชียร์
384,エールの交換,えーるのこうかん,การส่งเสียงเชียร์ใส่ซึ่งกันและกัน ของกองเชียร์ทั้ง 2 ฝ่าย
385,永久歯,えいきゅうし,ฟันแท้
386,営業補助,えいぎょうほじょ,"ผู้ช่วยการตลาด ผู้ช่วยฝ่ายขาย supporter marketing , sale marketing"
387,援護射撃,えんごしゃげき,1.ยิงเปิดทาง 2.พฤติกรรม หรือ คำพูด ที่ช่วยดัน ส่งเสิรมอีกฝ่ายหนึง
388,江戸っ子,えどっこ,1.เด็ก หรือ คนที่เกิดที่เอโดะ 2.เด็ก หรือ คนที่มีต้นกำเนิดที่โตเกียว (ตั้งแต่รุ่นปู่รุ่นย่า)
389,絵コンテ,えこんて,Storyboard สตอรี่บอรด์ หรือ ไกด์ไลน์ที่วาดขึ้นล่วงหน้า เอาไว้ดูเพื่อให้เข้าใจเนื้อเรื่องได้ง่ายขึ้น สำหรับ หนัง หรือ แวดวงโฆษณา
390,エアコン吹き出し口,えあこんふきだしぐち,ช่องแอร์ ช่องปล่อยแอร์
391,NOS,えんぬおーえす,"Nitrous Oxide Systems ニトロ　(亜酸化窒素)
"
392,抉り取る,えぐりとる,ล้วงออก คว้านออก
393,円了,えんりょう,ชื่อคนญี่ปุ่น เอนเรียว
394,園芸品種,えんげいひんしゅ,พันธ์พืชที่มีคุณสมบัติปลูกขึ้นตามการใช้งาน โดยเป็นการสร้างพันธ์ขึ้นของมนุษย์
395,江戸川,えどがわ,แม่น้ำ เอโดะ ในจังหวัดโตเกียว
396,永逝,えいせい,ตาย นอนหลับไม่ตื่น เสียชีวิต
397,江戸川乱歩,えどがわらんぽ,นักประพันธ์ ชื่อดัง ที่มีบทบาทในการแต่งนิยายแนวสืบสวน ของญี่ปุ่น
398,エビ春巻き,えびはるまき,ปอเปี๊ยะกุ้ง
399,榎本,えのもと,นามสกุลคนญี่ปุ่น เอโนโมโตะ
400,液化天然ガス,えきかてんねんがす,LNG (Liquefied Natural gas) เป็นก๊าซธรรมชาติที่ถูกทำให้อยู่ในรูปของเหลวเพื่อประโยชน์ในการขนส่งไปใช้ในที่ไกลๆ ก๊าซธรรมชาติเหลว 　
401,エアダクト,えあだくと,Air Duct สายอากาศ ท่ออากาศ
402,炎属性,えんぞくせい,ธาตุไฟ
403,エコ表示,えこひょうじ,แสดงผลแบบประหยัด
404,円筒状,えんとうじょう,รูปทรงกระบอก ทรงกลม
405,永遠恋愛,えいえんれんあい,"ความรักชั่วนิรันดร์,ความรักนานแสนนาน"
406,延長コード,えんちょうこーど,ปลั๊กพ่วง
407,エンジンを下ろす,えんじんをおろす,ยกเครื่อง เอาเครื่องออก
408,絵空事,えそらごと,เรื่องแต่ง เรื่องเพ้อฝัน
409,演出コンテ,えんしゅつこんて,สตอรี่บอร์ด เอฟเฟค
410,海老のすり身揚げ,えびのすりみあげ,ทอดมันกุ้ง 
411,厭世家,えんせいか,คนมองโลกในแง่ร้าย
412,厭世観,えんせいかん,1.ความรู้สึกเห็นผิดเป็นถูก เห็นดำเ้ป็นขาว 2. การมองโลกในแง่ร้าย
413,厭世主義,えんせいしゅぎ,1.ความรู้สึกเห็นผิดเป็นถูก เห็นดำเ้ป็นขาว 2. การมองโลกในแง่ร้าย
414,厭世的,えんせいてき,คนที่มองโลกในแง่ร้าย ในเชิงมองโลกในแง่ร้าย
415,エコー検査,えこーけんさ,การตรวจอุลตร้าซาวด์
416,江戸時代,えどじだい,ยุคสมัยเอโดะ
417,縁石,えんせき、ふちいし、へりいし,"ไหล่ทางเดิน,ริมทางเดิน,ทางกั้นทางเดิน"
418,栄養ドリンク剤,えいようどりんくざい,เครื่องดื่มชูกำลัง 
419,枝毛,えだげ,ผมแห้งแตกปลาย ผมแตกปลาย
420,縁故,えんこ,1. สายสัมพันธ์ สายเลือด 2. ความสัมพันธ์ระหว่างคนหนึ่ง กับ คนหนึ่ง 3. เหตุผล
421,縁故者,えんこしゃ,ญาติ 
422,得体,えたい,ตัวตนที่แท้จริง นิสัยที่แท้จริง
423,得体が知れない,えたいがしれない,ไม่รู้ตัวตนที่แท้จริง ไม่รู้นิสัย ความเป็นมาที่แท้จริง
424,エビの炭火焼き,えびのすみびやき,กุ้งเผา
425,A4変形版,えーよんへんけいばん,กระดาษ A4　รูปแบบหน้ากระดาษ  A4
426,A系,えーけい,คนที่ชื่นชอบสไตล์ หรือ แนวแฟชั่นของ อาคิฮาบาร่า
427,エアポケット,えあぽけっと,หลุมอากาศ
428,英知・叡智・叡知,えいち,สติปัญญาล้ำลึก
429,永住権,えいじゅうけん,สิทธิการอยู่อาศํยถาวร
430,枝道,えだみち,1.ถนนที่แยกออกไปจากถนนหลัก 2. หลุดจากประเด็นหลัก
431,営業利益,えいぎょうりえき,กำไรจากการดำเนินงาน (EBIT)
432,エノキダケ,えのきだけ,เห็ดเข็มทอง
433,海老詰めロール,えびつめろーる,ฮะเก๋า
434,円売り介入,えんうりかいにゅう,การแทรกแซงด้วยการขายเงินเยนออก เพื่อลดวิกฤต ค่าเงินเยนแข็ง
435,"<a href=""/dictionary/show/48845"">影響力</a>",えいきょうりょく,อิทธิพล มีบทบาท
436,エリア配分,えりあはいぶん,การแบ่งพื้นที่ 
437,衛生用マスク,えいせいようますく,หน้ากากอนามัย
438,蘞い・醶い,えぐい,"1.รสชาติจัดจนแสบคอ 2.โหด,รุนแรง,หนักหนาสาหัส 3. เลือดเย็น โหดเหี้ยม"
439,襟立て,えりたて,การตั้งปกคอเสื้อ
440,絵心,えごころ,1. คนที่มีความเข้าใจในศิลปะการวาดรูป หรือ ชอบวาดรูป 2. ความรู้สึกอยากวาดรูป
441,海老っ子,えびっこ,กุ้งเรดบี หรือ กุ้งแคระ สายพันธ์ที่มีราคาสูงที่สุด มีต้นกำเนิดจากประเทศญี่ปุ่น
442,英語力,えいごりょく,ความสามารถด้านภาษาอังกฤษ 
443,延伸区間,えんしんくかん,ส่วนต่อขยาย ( เช่นรถไฟฟ้า BTS )
444,"<a href=""/dictionary/show/49996"">選り好み•えり好み</a>",えりごのみ,การเลือกแต่ของที่ตัวเองชอบ
445,えぐい,えぐい,1. ลำบากเหนื่อยใจ รู้สึกแย่ ไม่เวริค์ งานหนัก 2. ยอดเยี่ยม สุดยอด
446,江戸前,えどまえ,"1.สไตล์เอโดะ,บรรยากาศแบบเอโดะ,บรรยากาศแบบโตเกียว (มักใช้กับของกิน) 2.อาหารเลิสรสสไตล์เอโดะ (มักใช้กับปลาดิบ ซูชิ ต่างๆ เพราะขึ้นชื่อเรื่องความสดอร่อย) "
447,縁覚,えんがく,พระปัจเจกพุทธเจ้า
448,遠赤外線,えんせきがいせん,"Far Infrared Ray รังสีอินฟาเรดนี้เป็นรูปแบบของพลังความร้อนจากแสงอาทิตย์ที่ไม่ต้องอาศัยอากาศเป็นสื่อกลางในการนำความร้อน เป็นพลังงานที่อยู่ในย่านที่ไม่สามารถมองเห็นได้ด้วยตาเปล่า
"
449,遠距離恋愛,えんきょりれんあい,ความรักห่างไกล ต่างคนต่างอยู่คนละที่
450,演習弾,えんしゅうだん,"กระสุนซ้อม, ลูกกระสุนปลอม"
451,栄養分,えいようぶん,โภชนาการ สารอาหาร
452,影響を来たす,えいきょうをきたす,เกิดผลกระทบในทางแย่ นำมาซึ่งผลลัพท์ที่ไม่ดี
453,営業側面支援,えいぎょうそくめんしえん,การช่วย หรือ สนับสนุนการขายทางอ้อม
454,鰓呼吸,えらこきゅう,หายใจทางเหงือก
455,海老味噌,えびみそ,กะปิ
456,遠隔地,えんかくち,ถิ่นธุรกันดาร ถิ่นที่อยู่ห่างไกลความเจริญ 
457,選りすぐる,えりすぐる,คัดสรรของที่ดีที่สุด เลือกแต่ของที่ดี
458,営業部長,えいぎょうぶちょう,ผู้จัดการฝ่ายขาย
459,依怙贔屓,えこひいき,"ความลำเอียง (การช่วยเหลือ หรือ ดูแลเฉพาะคนที่เราชอบ หรือ ถูกคอ การเลือกที่รักมักที่ชัง),เด็กในคาถา"
460,エスニック,えすにっく,"เกี่ยวกับเชื้อชาติ, เกี่ยวกับเผ่าพันธุ์"
461,"<a href=""/dictionary/show/51549"">影響を及ぼす</a>",えいきょうをおよぼす,ส่งผลกระทบถึง
462,越権行為,えっけんこうい,พฤติกรรม หรือ การใช้สิทธิอำนาจเกินขอบเขต
463,越権代理,えっけんだいり,การใช้อำนาจเกินขอบเขตของคนที่เป็นตัวแทน
464,えがらっぽい,えがらっぽい,รสชาติฝืดคอ
465,餌付け,えづけ,ใช้เหยี่อล่อ หรือ อาหารล่อ ให้สัตว์ หรือ ของนั้นๆ มีความสนิทสนม หรือ เข้าหาง่ายยิ่งขึ้น
466,"<a href=""/dictionary/show/52149"">栄養価</a>",えいようか,"คุณค่าทางอาหาร,คุณค่าทางโภชนาการ"
467,縁,えん,1. ขอบ ริม 2. กรรม 3. สายสัมพันธ์ ความสัมพันธ์
468,海老茶,えびちゃ,สีแดงม่วงเข้มอมน้ำตาล (maroon)
469,海老の触覚,えびのしょっかく,หนวดกุ้ง คู่หน้า ที่เอาไว้จับทิศทาง
470,映像操作卓,えいぞうそうさたく, image switcher console แผงคอนโซลควบคุมการออกภาพ ตัดภาพ
471,影像システム卓,えいぞうしすてむたく, image switcher console แผงคอนโซลควบคุมการออกภาพ ตัดภาพ
472,エラ洗い,えらあらい,จังหวะที่ปลาโดดเหนือน้ำพยายามสบัดให้หลุดจากขอที่เกี่ยวปากอยู่
473,栄養管理士,えいようかんりし,นักโภชนาการ 
474,縁,えん,1. พรหมลิขิต ความสัมพันธ์ที่นำพาคนมาพบกัน 2. ผลกรรมที่ส่งผลให้เกิดสิ่งนั้น
475,円形劇場,えんけいげきじょう,"สนามทรงกลม,สนามกีฬากรุงโรม,สนามกีฬาต่อสู้ (amphitheatrum、amphitheatre)"
476,円形闘技場,えんけいとうぎじょう,สนามกีฬากรุงโรม สนามกีฬาต่อสู้ amphitheatrum、amphitheatre
